facility_name,address,ward_name,lng,lat,recept_as,reception,workday
山田整形外科,東京都品川区二葉2-21-1,東京都品川区,139.723297,35.603573,かかりつけ優先,窓口,
千葉内科歯科クリニック,東京都品川区二葉2-2-2,東京都品川区,139.724289,35.606174,一般,窓口／電話(3781-2053),
横山外科内科,東京都品川区二葉2-3-1,東京都品川区,139.72522,35.605129,一般,窓口,
なるき内科クリニック,東京都品川区二葉3-26-6　ヴィラ西大井101,東京都品川区,139.720245,35.601898,一般,窓口,
二葉クリニック,東京都品川区二葉4-18-2,東京都品川区,139.71788,35.602016,一般,窓口,
原医院,東京都品川区平塚1-17-6　グリーンパレス戸越201,東京都品川区,139.713654,35.612896,一般,窓口／電話(3784-1123),
戸越銀座駅近内科クリニック,東京都品川区平塚1-7-16,東京都品川区,139.716141,35.61499,一般,窓口,
和田外科医院,東京都品川区平塚1-8-18　カスタリア戸越駅前1階,東京都品川区,139.715042,35.615074,一般,窓口／電話(3781-4936),
戸越銀座なかむら整形外科,東京都品川区平塚2-15-15　2階,東京都品川区,139.713867,35.61618,一般,窓口／電話(5749-7116),
たごファミリークリニック,東京都品川区平塚2-15-15　3階,東京都品川区,139.713867,35.61618,かかりつけ優先,窓口,
まつばらクリニック,東京都品川区平塚3-3-13　1階,東京都品川区,139.710831,35.616058,かかりつけのみ,窓口,
戸越泌尿器科内科クリニック,東京都品川区豊町1-3-17　山崎ビル1階,東京都品川区,139.723511,35.614285,一般,窓口,
青柳医院,東京都品川区豊町1-4-15　第一青柳ビル1階・2階,東京都品川区,139.722427,35.614468,かかりつけのみ,窓口,
ゆたか診療所,東京都品川区豊町4-18-21,東京都品川区,139.720566,35.60606,かかりつけのみ,窓口,
戸越パーククリニック,東京都品川区豊町6-10-4　西豊ビル1階,東京都品川区,139.717911,35.606159,かかりつけ優先,窓口／電話(3784-1054),
伊藤クリニック,東京都品川区豊町6-11-8,東京都品川区,139.717911,35.605389,一般,窓口／電話(3783-1020),
木内医院,東京都品川区豊町6-7-1,東京都品川区,139.71698,35.60614,かかりつけのみ,窓口,
東京シティクリニック品川,東京都品川区八潮5-10-27,東京都品川区,139.752625,35.599377,一般,Web／窓口,
園田クリニック,東京都品川区八潮5-6-37-105,東京都品川区,139.749603,35.596588,一般,窓口／電話(3799-0816),
川村内科クリニック,東京都品川区八潮5-8-47-105,東京都品川区,139.751862,35.597027,かかりつけ優先,窓口／電話(3799-1577),
松崎内科クリニック,東京都港区新橋1-15-5 ペルサ115 9階,東京都港区,139.757233,35.668022,,3591-7006,
森野クリニック,東京都港区新橋1-18-19 キムラヤ大塚ビル7F,東京都港区,139.755844,35.668629,,3591-2200,
新橋アレルギー・リウマチクリニック,東京都港区新橋2-16-1 ニュー新橋ビル318,東京都港区,139.757401,35.666309,,3591-6409,
ニュー新橋クリニック,東京都港区新橋2-16-1 ニュー新橋ビル4Ｆ,東京都港区,139.757401,35.666309,,3580-6775,
新橋青木クリニック,東京都港区新橋3-23-4 青木ビル,東京都港区,139.757782,35.664673,,3432-0381,
新橋日比谷通りクリニック,東京都港区新橋2-12-16 明和ビル3階,東京都港区,139.754761,35.667259,,3595-4976,
芝診療所,東京都港区新橋6-19-21,東京都港区,139.753586,35.660988,,3432-8701,
悠翔会在宅クリニック新橋,東京都港区新橋5-14-10 新橋スクエアビル7Ｆ,東京都港区,139.756378,35.662151,,6432-0312,
インターナショナルヘルスケアクリニック,東京都港区新橋2-10-5 末吉ビル3階,東京都港区,139.755753,35.667133,,3501-1332,
藤美クリニック,東京都港区西新橋1-24-16 平和ビル6F,東京都港区,139.751236,35.668411,,3501-3705,
西新橋みむろクリニック,東京都港区西新橋1-5-9 4F,東京都港区,139.753525,35.669243,,5251-8256,
汐留シティセンターセントラルクリニック,東京都港区東新橋1-5-2 汐留シティセンター3F,東京都港区,139.761398,35.665634,,5568-8700,
ペディ汐留クリニック,東京都港区東新橋1-9-1 東京汐留ビルディングB2F,東京都港区,139.760895,35.662498,,6274-5074,
藏本内科クリニック,東京都港区芝公園1-7-15 池田ビル1F,東京都港区,139.752365,35.657593,,5733-3355,
金杉橋クリニック,東京都港区浜松町2-13-4 KTビル3F,東京都港区,139.755386,35.653206,,3432-5721,
汐留健診クリニック,東京都港区浜松町1-17-10,東京都港区,139.755981,35.658207,,3432-8888,
おかだスマイルクリニック,東京都港区浜松町2-3-1 日本生命浜松町クレアタワー4F,東京都港区,139.755569,35.65564,,6809-1725,
浜松町メディカルクリニック,東京都港区芝大門2-3-11,東京都港区,139.753845,35.656261,,6809-2152,
竹芝水辺のクリニック,東京都港区海岸1-10-30 アトレ竹芝タワー棟3階,東京都港区,139.761902,35.657009,,3432-3232,
東京港診療所,東京都港区海岸3-9-5-2F,東京都港区,139.753876,35.638836,,3451-4620,
川島医院,東京都港区虎ノ門1-8-14 三昭ビル3F,東京都港区,139.75061,35.669235,,3519-6651,
神谷町クリニック,東京都港区虎ノ門3-17-1 TOKYU REIT虎ノ門ビル1F,東京都港区,139.746368,35.664059,,3433-0343,
虎ノ門中村クリニック,東京都港区虎ノ門3-10-4 虎ノ門ガーデン103,東京都港区,139.747925,35.665012,,6823-1409,
かみや町駅前クリニック,東京都港区虎ノ門4-2-4 クレッセント虎ノ門5階,東京都港区,139.745804,35.664181,,6450-1376,
虎の門耳鼻科クリニック,東京都港区虎ノ門1-1-25-6Ｆ,東京都港区,139.750565,35.670292,,3597-8286,
霞ヶ関診療所,東京都港区虎ノ門1-1-18 ヒューリック虎ノ門ビル2F,東京都港区,139.750565,35.670292,,080-8811-7000,
日比谷クリニック,東京都港区虎ノ門1-1-20 虎ノ門実業会館5Ｆ,東京都港区,139.750565,35.670292,,3508-2508,
アイビークリニック虎ノ門,東京都港区虎ノ門1-8-8,東京都港区,139.75061,35.669235,,5501-1511,
虎ノ門とうまクリニック,東京都港区虎ノ門1-1-16 虎の門中央ビル4Ｆ,東京都港区,139.750565,35.670292,,3502-4080,
菅沼三田診療所,東京都港区芝5-19-5 JP田町1F,東京都港区,139.747818,35.647621,,3452-1748,
篠原医院,東京都港区芝5-20-20,東京都港区,139.747101,35.647655,,3451-0528,
しば胃腸こうもんクリニック,東京都港区芝4-11-5 KTビル3F,東京都港区,139.7509,35.648159,,6453-9307,
東京シティクリニック三田,東京都港区芝4-5-8 池藤ビル2F,東京都港区,139.750885,35.648712,,5439-5566,
芝公園クリニック,東京都港区芝3-15-5 ジョイビレッジ芝公園3F,東京都港区,139.745316,35.65353,,3455-5525,
鈴木胃腸消化器クリニック,東京都港区芝5-27-1,東京都港区,139.74617,35.647045,,3455-6121,
港三田クリニック,東京都港区芝5-16-1 千代ビル3F,東京都港区,139.746155,35.648643,,3456-3391,
東京都済生会中央病院,東京都港区三田1-4-17 ,東京都港区,139.742737,35.653156,,,
三田国際ビルクリニック,東京都港区三田1-4-28 三田国際ビル3F,東京都港区,139.742737,35.653156,,3454-8614,
たまちホームクリニック,東京都港区三田3-1-4,東京都港区,139.74379,35.647675,,6435-2331,
三田ハウス内科クリニック,東京都港区三田5-2-18-109,東京都港区,139.737732,35.647598,,5443-3864,
もとやまクリニック,東京都港区白金1-8-9,東京都港区,139.731735,35.645992,,3473-2866,
白金タワークリニック,東京都港区白金1-17-1,東京都港区,139.733154,35.644455,,5789-3882,
耳鼻咽喉科望月医院,東京都港区白金3-10-18,東京都港区,139.731079,35.645184,,3442-3387,
白金三光クリニック,東京都港区白金1-25-31-102,東京都港区,139.732147,35.644268,,6456-4350,
都ホテル東京メディカルクリニック,東京都港区白金台1-1-50 都ホテル東京Ｂ1Ｆ,東京都港区,139.729813,35.63879,,3473-1651,
高輪台出川循環器・内科クリニック,東京都港区白金台2-11-8 永昌高輪台ビル3F,東京都港区,139.730743,35.632641,,5422-9105,
石原内科クリニック,東京都港区白金台4-2-11 3F,東京都港区,139.727798,35.639618,,5423-5560,
白金台診療所,東京都港区白金台5-18-6,東京都港区,139.72319,35.63689,,3473-4741,
白金高輪海老根ウィメンズクリニック,東京都港区高輪1-2-17 5F,東京都港区,139.735092,35.644142,,5789-2590,
かただ小児科クリニック,東京都港区高輪2-5-14-101,東京都港区,139.733597,35.636669,,5475-3260,
敬友クリニック高輪,東京都港区高輪2-14-17 グレイス高輪1Ｆ,東京都港区,139.737991,35.635578,,3442-5161,
品川ハートメディカルクリニック,東京都港区高輪2-15-11 高輪ホワイトマンション105,東京都港区,139.738358,35.636944,,5422-8841,
ぽれぽれクリニック,東京都港区高輪1-5-21 ルート高輪ビル4階,東京都港区,139.736771,35.641998,,5422-7626,
城南高輪クリニック,東京都港区高輪3-5-20 グランドメゾン高輪台1F,東京都港区,139.731461,35.633656,,3441-0435,
東京ベイクリニック,東京都港区海岸1-16-1 ニューピア竹芝サウスタワー,東京都港区,139.762466,35.652897,,5404-3842,
芝浦アイランド内科クリニック,東京都港区芝浦4-20-4 芝浦アイランドブルームホームズ2F,東京都港区,139.751404,35.639462,,5730-0221,
お台場クリニック,東京都港区台場1-5-7-105,東京都港区,139.777939,35.63018,,5531-0731,
芝浦ホームクリニック,東京都港区芝浦4-9-18-613,東京都港区,139.74646,35.640091,,5419-7746,
クリニックフォア田町,東京都港区芝浦3-1-32 なぎさテラス,東京都港区,139.748886,35.644985,,4579-8189,
有明みんなクリニック田町芝浦院,東京都港区芝浦3-2-28 HTアジール芝浦１F,東京都港区,139.750092,35.644482,,6722-6300,
高櫻内科・脳神経クリニック,東京都港区芝浦3-11-5 第三協栄ビル1F,東京都港区,139.749969,35.642895,,6722-6322,
ワールドシティ益子クリニック,東京都港区港南4-6-7 ワールドシティタワーズキャピタルタワー3F,東京都港区,139.751007,35.626987,,5783-0331,
若田クリニックシティタワー品川,東京都港区港南4-2-6-201,東京都港区,139.747742,35.629105,,3471-2972,
品川イーストクリニック,東京都港区港南2-15-2 品川インターシティB棟2Ｆ,東京都港区,139.742004,35.626335,,5783-5521,
品川クリニック,東京都港区港南2-16-3 品川グランドセントラルタワー1F,東京都港区,139.740677,35.626488,,6718-2816,
麻布光輝クリニック,東京都港区西麻布3-3-2,東京都港区,139.726715,35.657982,,6240-2912,
ウスイ内科クリニック,東京都港区西麻布3-2-21 センチュリオン六本木タワー5F,東京都港区,139.727295,35.659698,,3401-0271,
西麻布インターナショナルクリニック,東京都港区西麻布3-17-20 LY西麻布2階,東京都港区,139.725021,35.658821,,6447-5966,
えがおクリニック,東京都港区西麻布4-22-12 BIS西麻布2階,東京都港区,139.718735,35.65723,,6433-5310,
赤枝六本木診療所,東京都港区元麻布3-1-30,東京都港区,139.728485,35.657799,,3405-1388,
元麻布ヒルズメディカルクリニック,東京都港区元麻布1-3-3 元麻布ヒルズフォレストテラスウエストB1,東京都港区,139.731949,35.653934,,3798-2525,
中村クリニック,東京都港区六本木4-5-3,東京都港区,139.732468,35.665005,,3401-8003,
泉ガーデンクリニック,東京都港区六本木1-6-3 泉ガーデンウイングB1F,東京都港区,139.739487,35.664543,,5575-3888,
六本木ファーストクリニック,東京都港区六本木1-7-27 全特六本木ビルEAST 1F,東京都港区,139.740204,35.663788,,5574-7788,
岸本クリニック,東京都港区六本木5-16-4 4F,東京都港区,139.735794,35.660809,,3589-2112,
六本木北浜診療所,東京都港区六本木6-1-20 六本木電気ビル2Ｆ,東京都港区,139.731354,35.662449,,3402-0792,
あべ耳鼻咽喉科クリニック,東京都港区六本木6-1-20 六本木電気ビル2Ｆ,東京都港区,139.731354,35.662449,,3401-3387,
六本木にしやま整形外科,東京都港区六本木6-5-20,東京都港区,139.730759,35.661331,,3470-0015,
六本木ヒルズクリニック,東京都港区六本木6-10-1 六本木ヒルズ 森タワー6F,東京都港区,139.729202,35.660206,,3796-0066,
丸茂レディースクリニック,東京都港区六本木1-6-1 泉ガーデンタワー4F,東京都港区,139.739487,35.664543,,5575-5778,
ジェネラルクリニック,東京都港区六本木6-1-8 グリーンビル8F,東京都港区,139.731354,35.662449,,3401-0333,
モーニングクリニック六本木内科耳鼻咽喉科OR,東京都港区六本木6-1-8 六本木グリーンビル7F,東京都港区,139.731354,35.662449,,080-6727-5415,
祐ホームクリニック麻布台,東京都港区麻布台3-4-18-101,東京都港区,139.738678,35.659779,,050-3823-0159,
海渡医院,東京都港区麻布台1-10-11,東京都港区,139.742874,35.660393,,3583-0265,
八木医院,東京都港区東麻布1-18-9-101,東京都港区,139.742508,35.65583,,3583-0581,
ホロン鳥居坂クリニック耳鼻咽喉科アレルギー科,東京都港区麻布十番1-5-8 ヴェスタビル4F,東京都港区,139.732513,35.65749,,050-5357-2919,
たくま内科・神経内科クリニック,東京都港区麻布十番1-7-1 ＭＧＢ麻布十番ビル4階,東京都港区,139.734726,35.656441,,6434-7478,
みのやまクリニック,東京都港区麻布十番2-1-1 あべちゃんビル4階,東京都港区,139.736313,35.655384,,6459-2686,
麻布医院,東京都港区麻布十番1-11-1 エスティメゾン麻布十番3階,東京都港区,139.736496,35.655727,,5545-8177,
馬場クリニック,東京都港区麻布十番2-13-2,東京都港区,139.735077,35.654858,,3454-7788,
草間かほるクリニック,東京都港区麻布十番3-5-1 バルゴ麻布ビル5F,東京都港区,139.735489,35.653175,,5730-1926,
中村麻布十番クリニック,東京都港区麻布十番2-2-10-2F,東京都港区,139.735657,35.655411,,5419-7300,
大森真帆麻布十番クリニック,東京都港区麻布十番1-5-9 高橋ビル2階,東京都港区,139.732513,35.65749,,6455-4317,
サニーガーデンこどもクリニック,東京都港区麻布十番2-16-4 プラスワンビル3F,東京都港区,139.735474,35.654083,,6722-6623,
麻布ウィメンズクリニック,東京都港区麻布十番2-3-12-3F,東京都港区,139.735184,35.655529,,6809-3103,
MastBeautyクリニック麻布十番,東京都港区麻布十番1-6-5 ラミューズビル5F,東京都港区,139.734238,35.65659,,3478-1107,
医療法人財団厚生会古川橋病院,東京都港区南麻布2-10-21,東京都港区,139.735596,35.647991,,3453-5011,
喜島クリニック,東京都港区南麻布5-10-24 第二佐野ビル4F,東京都港区,139.722626,35.653286,,5791-3424,
フローイーストクリニック,東京都港区南麻布5-10-24 7Ｆ,東京都港区,139.722626,35.653286,,050-5511-0770,
愛育クリニック,東京都港区南麻布5-6-8,東京都港区,139.727524,35.652748,,3473-8305,
優里医院,東京都港区南麻布4-11-30 南麻布澁谷ビル7Ｆ,東京都港区,139.726913,35.647697,,6450-3500,
南青山さとう内科,東京都港区南青山6-12-11,東京都港区,139.715103,35.660583,,3409-7150,
青山内科医院,東京都港区南青山5-1-22 青山ライズスクエア3F,東京都港区,139.712662,35.664352,,3499-6500,
南青山内科クリニック,東京都港区南青山7-8-8-101,東京都港区,139.716965,35.658722,,6805-1836,
やべ耳鼻咽喉科表参道,東京都港区南青山5-10-19 5F,東京都港区,139.71109,35.66259,,3409-3387,
中山医院,東京都港区南青山3-14-19,東京都港区,139.714783,35.665279,,6434-5122,
青山明石クリニック,東京都港区南青山3-14-24-104,東京都港区,139.714783,35.665279,,6447-4525,
青山耳鼻咽喉科,東京都港区南青山2-13-11 マストライフ南青山301,東京都港区,139.720459,35.670757,,3478-8741,
南青山おおつかクリニック,東京都港区南青山4-9-17,東京都港区,139.718109,35.666904,,5786-3288,
青山メディカルクリニック,東京都港区南青山3-10-21 T'S BRIGHTIA 南青山 EAST 1F,東京都港区,139.715073,35.666058,,6434-7118,
武村医院,東京都港区北青山3-12-2,東京都港区,139.710175,35.663441,,3407-7826,
仁保医院,東京都港区北青山3-2-5 NH青山ビル3F,東京都港区,139.715485,35.669067,,3401-1001,
アットホーム表参道クリニック,東京都港区北青山2-12-31 第3イノセビル2階・地下1階,東京都港区,139.715622,35.670555,,3423-3232,
おりつこどもクリニック,東京都港区北青山3-5-4 青山高野ビル5F,東京都港区,139.712769,35.665634,,6721-1188,
岩沢医院,東京都港区赤坂3-1-16 BＩビル2F,東京都港区,139.736816,35.677105,,3583-6155,
清水クリニック,東京都港区赤坂4-4-11 赤坂丹後町ビル1F,東京都港区,139.734467,35.673923,,6441-0358,
赤坂内視鏡クリニック,東京都港区赤坂3-5-5 ストロング赤坂ビル5F,東京都港区,139.738708,35.673645,,6441-2528,
赤坂おだやかクリニック,東京都港区赤坂5-3-1 赤坂Bizタワーアネックス2F,東京都港区,139.735168,35.672558,,6234-0511,
大星クリニック,東京都港区赤坂2-9-11 オリックス赤坂2丁目ビルB1,東京都港区,139.741013,35.671112,,6426-5933,
おおたけ消化器内科クリニック,東京都港区赤坂6-3-20 HATビル4階,東京都港区,139.735626,35.671009,,3588-1371,
赤坂ファミリークリニック,東京都港区赤坂2-15-15 赤坂プラザビル3F,東京都港区,139.738037,35.671497,,5562-8825,
菅原クリニック東京脳ドック,東京都港区赤坂5-2-20 赤坂パークビル2F,東京都港区,139.73317,35.67231,,5573-8822,
赤坂インターナショナルクリニック,東京都港区赤坂5-5-10 赤坂大高ビル2F,東京都港区,139.733826,35.670654,,6277-6337,
駒一クリニック,東京都豊島区駒込1-4-1　,東京都豊島区,139.748566,35.73431,,03-5977-8701,
部坂耳鼻咽喉科医院,東京都豊島区駒込1-29-1　,東京都豊島区,139.749054,35.737045,,03-3946-2087,
とみたまさこレディースクリニック,東京都豊島区駒込1-32-1 駒込富士ハイツ１F,東京都豊島区,139.748871,35.735912,,03-3947-7070,
駒込山王クリニック,東京都豊島区駒込1-37-10 駒信インテリジェントビル1階,東京都豊島区,139.74823,35.735546,,03-6304-1839,
安井医院,東京都豊島区駒込1-44-1　,東京都豊島区,139.74614,35.735989,,03-3941-5677,
駒込北口クリニック,東京都豊島区駒込2-3-6　,東京都豊島区,139.746948,35.737568,,03-3949-2177,
加塚医院,東京都豊島区駒込2-5-5　,東京都豊島区,139.746536,35.737926,,03-3910-3811,
高橋クリニック,東京都豊島区駒込2-12-11　古川ビル2F,東京都豊島区,139.748032,35.738453,,03-5907-7311,
金澤医院,東京都豊島区駒込3-5-7　,東京都豊島区,139.744965,35.736568,,03-3910-4952,
みやけ医院,東京都豊島区駒込4-2-17　,東京都豊島区,139.743607,35.735928,,03-6903-7211,
野田さくらハートクリニック,東京都豊島区駒込4-15-19　,東京都豊島区,139.739731,35.737328,,03-3915-5500,
幸和クリニック,東京都豊島区駒込6-33-17,東京都豊島区,139.742065,35.741592,,03-3917-8105,
小林内科クリニック,東京都豊島区巣鴨1-4-1,東京都豊島区,139.742355,35.733196,,03-5977-8070,
巣鴨ホームクリニック,東京都豊島区巣鴨1-12-1　冠城園ビル6F,東京都豊島区,139.73996,35.732616,,03-6912-2995,
アーバンハイツクリニック,東京都豊島区巣鴨1-16-2　アーバンハイツ巣鴨B棟1F,東京都豊島区,139.739151,35.733418,,03-3946-6721,
すがも腎クリニック,東京都豊島区巣鴨1-18-8　巣鴨東宝ビル,東京都豊島区,139.739441,35.732368,,03-6902-3880,
巣鴨駅前胃腸内科クリニック,東京都豊島区巣鴨1-18-11　十一屋ビル4F,東京都豊島区,139.739441,35.732368,,03-5940-3833,
櫻和メンタルクリニック,東京都豊島区巣鴨1-19-12　八木下ビル2F・3F,東京都豊島区,139.740143,35.731804,,03-5319-1908,
巣鴨山口内科・糖尿病内科クリニック,東京都豊島区巣鴨1-20-10　宝生第一ビル3F A室,東京都豊島区,139.740768,35.731224,,03-5395-5700,
松丸胃腸科外科,東京都豊島区巣鴨1-24-8-1F　,東京都豊島区,139.739792,35.731514,,03-3944-4462,
巣鴨泌尿器科・内科クリニック,東京都豊島区巣鴨1-30-2　ハイツサンアベニュー2F,東京都豊島区,139.737854,35.731934,,03-6912-0767,
及川醫院,東京都豊島区巣鴨1-40-5　SHIROビルヂング2F,東京都豊島区,139.736649,35.7314,,03-3945-9270,
すがも北口内科クリニック,東京都豊島区巣鴨2-3-10　森川第一ビル5F,東京都豊島区,139.738861,35.73418,,03-5980-9225,
巣鴨クリニック,東京都豊島区巣鴨2-4-2　岡田ビル301,東京都豊島区,139.739243,35.734493,,03-3918-1666,
巣鴨こし石クリニック,東京都豊島区巣鴨3-30-3,東京都豊島区,139.737366,35.733967,,03-3918-6566,
司生堂クリニック,東京都豊島区巣鴨3-33-3　司生堂ビル2F,東京都豊島区,139.736389,35.735119,,03-3910-8181,
とよかま内科,東京都豊島区巣鴨3-34-10　イーグル巣鴨101号室,東京都豊島区,139.735947,35.735458,,03-5961-5152,
江戸橋診療所,東京都豊島区巣鴨4-4-8　,東京都豊島区,139.730713,35.736134,,03-3918-1768,
巣鴨医院,東京都豊島区巣鴨4-22-4　,東京都豊島区,139.734344,35.736721,,03-5567-1955,
吉田クリニック,東京都豊島区巣鴨4-30-12,東京都豊島区,139.732727,35.738857,,03-5907-3553,
藤本医院,東京都豊島区西巣鴨1-9-1　,東京都豊島区,139.723541,35.737827,,03-5974-1577,
山口医院,東京都豊島区西巣鴨1-19-17　,東京都豊島区,139.725204,35.736866,,03-3915-5885,
仙石クリニック,東京都豊島区西巣鴨1-21-4　,東京都豊島区,139.726456,35.736942,,03-3576-5858,
月本診療所,東京都豊島区西巣鴨2-1-16　,東京都豊島区,139.729691,35.737041,,03-3918-6272,
久保田クリニック,東京都豊島区西巣鴨3-19-3　,東京都豊島区,139.727081,35.742031,,03-3917-0062,
高田クリニック,東京都豊島区西巣鴨3-25-11-207,東京都豊島区,139.728287,35.743652,,03-3576-7275,
一心病院,東京都豊島区北大塚1-18-7,東京都豊島区,139.73027,35.732704,,03-3918-1215,
晴和ハートクリニック,東京都豊島区北大塚2-2-5　晴和ビル3階,東京都豊島区,139.727783,35.732151,,03-3917-3503,
横山クリニック,東京都豊島区北大塚2-2-5　晴和ビル6階,東京都豊島区,139.727783,35.732151,,03-5944-5881,
大塚北口診療所,東京都豊島区北大塚2-6-12　青木ビル,東京都豊島区,139.727783,35.732529,,03-3949-1141,
大塚山田脳神経外科クリニック,東京都豊島区北大塚2-10-5　北大塚BMAビル3F,東京都豊島区,139.727158,35.733665,,03-5961-0533,
山下診療所大塚,東京都豊島区北大塚2-13-1　ba07 5F,東京都豊島区,139.728592,35.732315,,03-3910-6711,
山手大塚レディスクリニック,東京都豊島区北大塚2-13-1　ba07ビル 7F,東京都豊島区,139.728592,35.732315,,03-5907-6158,
大塚整形外科,東京都豊島区北大塚2-16-8　バロックコート大塚2F,東京都豊島区,139.728546,35.732998,,03-3917-1777,
伊藤内科小児科医院,東京都豊島区北大塚2-17-12　,東京都豊島区,139.728027,35.733555,,03-3918-4074,
大塚メディカルクリニック,東京都豊島区北大塚2-27-3,東京都豊島区,139.729828,35.732494,,03-5961-5850,
モモ・メディカル・クリニック,東京都豊島区南大塚1-51-1　,東京都豊島区,139.730804,35.730137,,03-3945-3344,
渡辺胃腸科医院,東京都豊島区南大塚1-53-1　,東京都豊島区,139.730606,35.730568,,03-3943-6371,
大蔵耳鼻咽喉科,東京都豊島区南大塚2-11-8　,東京都豊島区,139.731049,35.725468,,03-3947-8733,
はせがわ内科クリニック,東京都豊島区南大塚2-13-12　ラ・コリーナ南大塚101,東京都豊島区,139.731537,35.726139,,03-6902-2602,
まの産婦人科,東京都豊島区南大塚2-25-9　田口ビル1階,東京都豊島区,139.73053,35.726986,,03-5940-0303,
大塚第一診療所,東京都豊島区南大塚2-25-20　,東京都豊島区,139.73053,35.726986,,03-3941-0888,
ひいらぎクリニック,東京都豊島区南大塚2-35-8　NYビル6F,東京都豊島区,139.729813,35.7285,,03-6902-0809,
くにやクリニック,東京都豊島区南大塚2-37-11-101　,東京都豊島区,139.730835,35.729027,,03-5319-0873,
南大塚クリニック,東京都豊島区南大塚2-41-9　坂本ビル1F,東京都豊島区,139.729416,35.729713,,03-3943-7277,
南大塚耳鼻咽喉科クリニック,東京都豊島区南大塚2-42-6　信友大塚ビル5F,東京都豊島区,139.729477,35.730145,,03-6912-0187,
クリニック西川,東京都豊島区南大塚2-45-9　ヤマナカヤビル1F,東京都豊島区,139.729553,35.730633,,03-5395-0721,
