facility_name,address,ward_name,lng,lat,recept_as,reception,workday
大塚南口駅前脳神経内科クリニック,東京都豊島区豊島区南大塚3-32-10今井保全ビル１Ｆ,東京都豊島区,139.715897,35.732368,,03-5955-7760,
大塚・栄一クリニック,東京都豊島区南大塚3-45-5　サンユースビル1階,東京都豊島区,139.728561,35.729435,,03-3987-8110,
関内科小児科,東京都豊島区上池袋1-10-5,東京都豊島区,139.719284,35.735546,,03-3916-5200,
せきや内科クリニック,東京都豊島区上池袋1-37-22　レジディアタワー上池袋1F,東京都豊島区,139.723221,35.736809,,03-5980-7200,
なかやクリニック,東京都豊島区上池袋2-44-7　,東京都豊島区,139.717804,35.737999,,03-3917-1888,
たかのクリニック,東京都豊島区上池袋3-34-12　,東京都豊島区,139.721313,35.738136,,03-3916-3818,
江夏医院,東京都豊島区上池袋4-2-3-1F　,東京都豊島区,139.721848,35.739315,,03-3915-6824,
北池袋よしだ内科クリニック,東京都豊島区上池袋4-29-9　北池テラス4F,東京都豊島区,139.718414,35.741287,,03-3916-8010,
東京ヴェインクリニック,東京都豊島区東池袋1-7-5　池袋イースタンビル5F,東京都豊島区,139.713989,35.73159,,03-6908-2272,
池袋さゆり眼科,東京都豊島区東池袋1-10-1　住友池袋駅前ビル2F,東京都豊島区,139.714417,35.730347,,03-5962-0656,
慶愛クリニック,東京都豊島区東池袋1-12-8　富士喜ﾋﾞﾙ4F,東京都豊島区,139.714645,35.729099,,03-3987-3090,
柴内科医院,東京都豊島区東池袋1-15-3　近代グループBLD.12　3F,東京都豊島区,139.715027,35.731037,,03-3971-4418,
林クリニック,東京都豊島区東池袋1-39-15　シャトレー東池袋204室,東京都豊島区,139.714325,35.732437,,03-3988-2773,
池袋東口まめクリニック,東京都豊島区東池袋1-42-12 ステーションサイドビル 3F,東京都豊島区,139.71315,35.732353,,03-6915-2472,
岡本病院,東京都豊島区東池袋2-5-5　,東京都豊島区,139.724579,35.730385,,03-3987-6580,
光和メディカルクリニック,東京都豊島区東池袋2-9-7　１Ｆ,東京都豊島区,139.723907,35.73061,,03-6903-6951,
山下医院,東京都豊島区東池袋2-11-8-1階,東京都豊島区,139.724518,35.731007,,03-3971-4994,
藤山医院,東京都豊島区東池袋2-18-6　,東京都豊島区,139.724228,35.731361,,03-3981-8439,
おおこし医院,東京都豊島区東池袋2-26-4,東京都豊島区,139.72345,35.731316,,03-3971-3012,
ステラ耳鼻咽喉科,東京都豊島区東池袋2-45-2　ステラビル1F,東京都豊島区,139.720093,35.732231,,03-3983-7570,
後藤クリニック,東京都豊島区東池袋2-45-4　メロス学園ビル1F,東京都豊島区,139.720093,35.732231,,03-5928-0510,
水庭クリニック,東京都豊島区東池袋2-55-4　,東京都豊島区,139.71875,35.733505,,03-3971-7057,
さとう消化器内科クリニック,東京都豊島区東池袋2-60-3　グレイスロータリービル2F,東京都豊島区,139.717697,35.733593,,03-3590-8111,
林胃腸科・外科クリニック,東京都豊島区東池袋3-1-1　サンシャイン60ビル7F,東京都豊島区,139.719193,35.72929,,03-3988-5700,
山口クリニック,東京都豊島区東池袋3-1-1　サンシャイン60ビル7F,東京都豊島区,139.719193,35.72929,,03-3988-0100,
池袋病院,東京都豊島区東池袋3-5-4　,東京都豊島区,139.717163,35.731285,,03-3987-2431,
髙橋内科医院,東京都豊島区東池袋3-13-13　,東京都豊島区,139.717911,35.731918,,03-3971-4581,
ライズシティクリニック,東京都豊島区東池袋4-5-1　エアライズタワー108,東京都豊島区,139.718964,35.726696,,03-5944-9292,
池袋血管外科クリニック,東京都豊島区南池袋1－17－2　南池袋Ｉ－Ｎビル7階,東京都豊島区,139.711426,35.727013,,03-5928-4888,
耳鼻咽喉科北川医院,東京都豊島区南池袋2-12-9　,東京都豊島区,139.713608,35.725899,,03-3971-5521,
大木医院,東京都豊島区南池袋2-19-4　,東京都豊島区,139.714127,35.726162,,03-5391-7886,
池袋久野クリニック,東京都豊島区南池袋2-26-5　アイアンドイー池袋ビル9F,東京都豊島区,139.713272,35.727856,,03-5949-6119,
池袋セントラルクリニック,東京都豊島区南池袋2-26-7 城北ビル6F,東京都豊島区,139.713272,35.727856,,03-5911-7262,
iクリニック,東京都豊島区南池袋2-27-4　青柳池袋駅前ビル2F,東京都豊島区,139.713882,35.728485,,03-6914-1906,
池袋なごみクリニック,東京都豊島区南池袋2-27-4　青柳池袋駅前ビル7F,東京都豊島区,139.713882,35.728485,,03-6709-1392,
木村整形外科,東京都豊島区南池袋2-29-4　,東京都豊島区,139.715607,35.727776,,03-3984-3306,
としま整形外科リウマチクリニック,東京都豊島区南池袋2-45-3　としまエコミューセゼタウン2F,東京都豊島区,139.71666,35.726074,,03-5951-5858,
東池袋きむら内科クリニック,東京都豊島区南池袋2-45-3　としまエコミューゼタウン2F,東京都豊島区,139.71666,35.726074,,03-5904-8177,
あずま通りクリニック,東京都豊島区南池袋3-18-34-101　,東京都豊島区,139.714813,35.724045,,03-3982-7203,
南池袋介護老人保健施設アバンセ,東京都豊島区南池袋4-6-1,東京都豊島区,139.716522,35.721931,,03-5955-7370,
藤田クリニック,東京都豊島区西池袋1-2-2　ウエストワンビル3F,東京都豊島区,139.709213,35.72768,,03-3981-7728,
池袋メトロポリタンクリニック,東京都豊島区西池袋1-11-1　ルミネ10階,東京都豊島区,139.709442,35.728977,,03-5954-1266,
光明クリニック池袋,東京都豊島区西池袋1-12-1　エソラ池袋5階,東京都豊島区,139.709625,35.729729,,03-6915-2612,
池袋駅前あおぞらクリニック,東京都豊島区西池袋1-16-1　新東第一ビル6階,東京都豊島区,139.709045,35.73082,,03-6914-0753,
セイントクリニック池袋駅前,東京都豊島区西池袋1-16-10第2三笠ビル3階,東京都豊島区,139.709045,35.73082,,03-6812-1901,
あんこうメディカルクリニック,東京都豊島区西池袋1-17-10　エキニア池袋7F,東京都豊島区,139.708435,35.731014,,03-3971-9941,
池袋大谷クリニック,東京都豊島区西池袋1-39-4　第1大谷ビル1階,東京都豊島区,139.709702,35.732811,,03-3986-0337,
池袋心療内科メディカルオーククリニック,東京都豊島区西池袋1-39-4　第1大谷ビル5階,東京都豊島区,139.709702,35.732811,,03-5391-9602,
池袋大久保医院,東京都豊島区西池袋1-43-5　,東京都豊島区,139.711304,35.733028,,03-3987-3785,
平塚胃腸病院,東京都豊島区西池袋3-2-16　,東京都豊島区,139.705719,35.72831,,03-3982-1161,
ノガキクリニック,東京都豊島区西池袋3-22-13　丸栄ビル2F,東京都豊島区,139.70639,35.730228,,03-3980-6150,
優レディースクリニック,東京都豊島区西池袋3-25-11　CICIKEBUKUROﾋﾞﾙ2Ｆ,東京都豊島区,139.707352,35.730026,,03-3984-2278,
立教通り皮フ科形成外科,東京都豊島区西池袋3-29-9　池袋C3ビル1F,東京都豊島区,139.706741,35.7313,,03-5954-3051,
西池袋醫院,東京都豊島区西池袋4-32-8　,東京都豊島区,139.69722,35.727146,,03-6909-3303,
タワーグランディア内科クリニック,東京都豊島区西池袋5-5-21,東京都豊島区,139.705215,35.731922,,03-5911-7591,
なかい耳鼻咽喉科クリニック,東京都豊島区西池袋5-5-21　ザ・タワーグランディア2F,東京都豊島区,139.705215,35.731922,,03-5960-4133,
渡辺整形・形成外科,東京都豊島区西池袋5-5-21 ザ・タワーグランディア2F203,東京都豊島区,139.705215,35.731922,,03-5979-8840,
大木眼科,東京都豊島区池袋2-17-1,東京都豊島区,139.706177,35.732594,,03-3971-2598,
矢部クリニック,東京都豊島区池袋2-24-2　,東京都豊島区,139.70343,35.733387,,03-3982-3191,
安康レディースクリニック,東京都豊島区池袋2-42-3　オスカービル2F,東京都豊島区,139.709625,35.73357,,03-3971-3544,
平和国際医院,東京都豊島区池袋2-48-8　恩和ビル2階,東京都豊島区,139.711395,35.733604,,03-5904-8608,
池袋2丁目医院,東京都豊島区池袋2-53-8　秋島ビル3F,東京都豊島区,139.709076,35.734043,,03-3981-9505,
たじま医院,東京都豊島区池袋2-61-5　,東京都豊島区,139.709808,35.734947,,03-3971-0388,
関野臨床薬理クリニック,東京都豊島区池袋3-28-3　,東京都豊島区,139.706161,35.735142,,03-5396-4530,
関野病院,東京都豊島区池袋3-28-3　,東京都豊島区,139.706161,35.735142,,03-3986-5501,
阿部医院,東京都豊島区池袋3-70-1　,東京都豊島区,139.705658,35.738575,,03-3971-5570,
土屋医院,東京都豊島区池袋4-17-10,東京都豊島区,139.708054,35.739388,,03-3971-1848,
田村医院,東京都豊島区池袋本町1-45-16,東京都豊島区,139.713333,35.740429,,03-5985-1424,
池袋むらかみ整形外科,東京都豊島区池袋本町1‐45‐16　プラザ田村1階・地下1階,東京都豊島区,139.713333,35.740429,,03-3971‐2830,
岡田医院,東京都豊島区池袋本町2-32-8　,東京都豊島区,139.709946,35.742874,,03-3982-6051,
川口クリニック,東京都豊島区雑司が谷1-9-7,東京都豊島区,139.717911,35.720085,,03-5396-8036,
平井医院,東京都豊島区雑司が谷1-26-10　,東京都豊島区,139.720718,35.720314,,03-3971-8064,
雑司が谷赤ちゃん・こどもクリニック,東京都豊島区雑司が谷3-1-20　S.Z.ビル201,東京都豊島区,139.713852,35.719566,,03-6907-0037,
鬼子母神診療所,東京都豊島区雑司が谷3-3-17　,東京都豊島区,139.713882,35.720409,,03-3984-6821,
清水クリニック,東京都豊島区雑司が谷3-7-3　,東京都豊島区,139.713333,35.721161,,03-3980-8182,
鶉山医院,東京都豊島区雑司が谷3-8-10　セレナ目白雑司が谷101,東京都豊島区,139.713058,35.721489,,03-3982-1331,
町のクリニック目白,東京都豊島区高田1-19-21　メゾンソレイユ1F,東京都豊島区,139.71524,35.714504,,03-3971-5500,
くじら在宅クリニック,東京都豊島区高田1-37-10　ツーウッズ目白ビル201,東京都豊島区,139.716156,35.717361,,03-6915-2011,
岡崎耳鼻咽喉科医院,東京都豊島区高田1-40-12　岡崎ビル2F,東京都豊島区,139.717407,35.716785,,03-3981-0763,
高田馬場病院,東京都豊島区高田3-8-9,東京都豊島区,139.706497,35.714737,,03-3971-5114,
ゆみのハートクリニック,東京都豊島区高田3-14-29　KDX高田馬場ビル1F,東京都豊島区,139.705017,35.715343,,03-5956-8010,
私のクリニック目白,東京都豊島区目白1-4-1　ホテルメッツ目白1F,東京都豊島区,139.706421,35.719776,,03-5992-5550,
クリニック安田,東京都豊島区目白2-5-27　目白邸苑ビル2F,東京都豊島区,139.712143,35.720997,,03-3986-4466,
目白耳鼻咽喉科,東京都豊島区目白2-5-27　目白メディカルロード2F,東京都豊島区,139.712143,35.720997,,03-5954-4133,
目白整形外科内科,東京都豊島区目白2-38-2　,東京都豊島区,139.707504,35.722092,,03-5960-7800,
目白駅前クリニック,東京都豊島区目白3-4-11 ヒュ-リック目白3階,東京都豊島区,139.705887,35.721725,,03-5906-5806,
目白MMクリニック,東京都豊島区目白3-4-12　Ｅ＆Ｋビル5F,東京都豊島区,139.705887,35.721725,,03-6915-3250,
目白駅前たけしクリニック,東京都豊島区目白3-4-12　Ｅ＆Ｋビル２階,東京都豊島区,139.705887,35.721725,,03-3954-2810,
あいメディカルクリニック,東京都豊島区目白3‐4‐18　小野ビル3階,東京都豊島区,139.705887,35.721725,,03‐3565‐6310,
めじろ内科クリニック,東京都豊島区目白3-5-11　NOBビル3F,東京都豊島区,139.704941,35.722206,,03-3953-5831,
目白医院,東京都豊島区目白3-5-13　フジヤビル7階,東京都豊島区,139.704941,35.722206,,03-3954-0062,
荒木医院,東京都豊島区目白3-6-4,東京都豊島区,139.704453,35.723061,,03-3953-4006,
東京目白クリニック,東京都豊島区目白3-14-3　目白寛永堂ビル8階,東京都豊島区,139.706116,35.72208,,03-6908-2775,
もちづき耳鼻咽喉科,東京都豊島区目白3‐14‐21　大野ビル2階,東京都豊島区,139.706116,35.72208,,03‐5988‐7551,
聖マリアビルクリニック,東京都豊島区目白3-15-3　聖マリアビル1F,東京都豊島区,139.706268,35.723106,,03-3953-2455,
目白おかの内科,東京都豊島区目白3-16-15　茜ビル1F,東京都豊島区,139.706879,35.723053,,03-5988-3363,
村井耳鼻咽喉科医院,東京都豊島区目白4-7-12　,東京都豊島区,139.697891,35.72229,,03-3951-3431,
たなか耳鼻咽喉科,東京都豊島区目白5-4-7,東京都豊島区,139.694534,35.722649,,03-3951-0201,
河住内科循環器科,東京都豊島区南長崎1-5-18,東京都豊島区,139.692184,35.723545,,03-3951-0410,
古明地医院,東京都豊島区南長崎1-16-17　,東京都豊島区,139.693466,35.725208,,03-3951-6808,
椎名町クリニック,東京都豊島区南長崎1-25-6　グリンスティ1F,東京都豊島区,139.693756,35.726395,,03-5988-0131,
ファミリークリニックしいなまち,東京都豊島区南長崎1-25-26　ファーマシティⅡ.2A,東京都豊島区,139.693756,35.726395,,03-6908-2234,
井口クリニック,東京都豊島区南長崎2-5-12　,東京都豊島区,139.690643,35.723621,,03-5988-7595,
南長崎こみ山医院,東京都豊島区南長崎3-14-17-1F　,東京都豊島区,139.687363,35.724579,,03-3953-0086,
平間医院,東京都豊島区南長崎3-39-13　,東京都豊島区,139.687515,35.727238,,03-3951-3361,
アルパカ小児科耳鼻科クリニック,東京都豊島区南長崎4-5-20　アイテラス落合南長崎3F,東京都豊島区,139.682755,35.724232,,03-3565-6639,
きたほり内科クリニック,東京都豊島区南長崎4-5-20　アイテラス落合南長崎3F,東京都豊島区,139.682755,35.724232,,03-3565-7710,
城田医院,東京都豊島区南長崎5-5-2　,東京都豊島区,139.681168,35.727726,,03-3950-0776,
としま昭和病院,東京都豊島区南長崎5-17-9　,東京都豊島区,139.68219,35.728733,,03-3953-5555,
小川クリニック,東京都豊島区南長崎6-7-11　,東京都豊島区,139.678009,35.729652,,03-3951-0356,
柳沢医院,東京都豊島区南長崎6-21-21　,東京都豊島区,139.68129,35.730431,,03-3951-5107,
たかしま内科クリニック,東京都豊島区長崎1-2-8　KABURAGIビル1F　,東京都豊島区,139.694794,35.726826,,03-3530-2323,
武藤クリニック,東京都豊島区長崎1-22-11　,東京都豊島区,139.693893,35.730289,,03-3957-7065,
衞藤医院,東京都豊島区長崎2-3-19　,東京都豊島区,139.691315,35.72747,,03-3957-2284,
寺田クリニック,東京都豊島区長崎2-27-19　,東京都豊島区,139.692947,35.729588,,03-3957-4567,
ながしま脳外科・内科クリニック,東京都豊島区長崎3-19-14　ミザールビル1F,東京都豊島区,139.688492,35.730232,,03-5917-6850,
そわクリニック東長崎,東京都豊島区長崎4-7-8　第3大同ﾋﾞﾙ3Ｆ,東京都豊島区,139.684372,35.729763,,03-5926-3171,
東長崎駅前内科クリニック,東京都豊島区長崎4-7-11 マスターズ東長崎1F,東京都豊島区,139.684372,35.729763,,03-5926-9664,
しゅっとう医院,東京都豊島区長崎4-7-12　相澤ビル1階,東京都豊島区,139.684372,35.729763,,03-3958-7200,
進士医院,東京都豊島区長崎4-14-14　,東京都豊島区,139.68541,35.72979,,03-3959-0525,
豊島長崎クリニック,東京都豊島区長崎4-25-15　,東京都豊島区,139.685623,35.730389,,03-6905-8682,
鵜木耳鼻咽喉科医院,東京都豊島区長崎5-33-10,東京都豊島区,139.683273,35.735237,,03-3957-4720,
吾妻医院,東京都豊島区長崎6-2-12　,東京都豊島区,139.680038,35.733429,,03-3957-5502,
豊島整形外科・内科,東京都豊島区千早4-34-7,東京都豊島区,139.684341,35.739368,,03-5917-2833,
要町駅前クリニック,東京都豊島区要町1-1-11　要町ＫＴﾋﾞﾙ7Ｆ　,東京都豊島区,139.6987,35.732983,,03-3955-0022,
手塚クリニック,東京都豊島区要町1-11-1,東京都豊島区,139.699158,35.733604,,03-3957-3456,
要町ホームケアクリニック,東京都豊島区要町1-11-10　セピアネクスト1階,東京都豊島区,139.699158,35.733604,,03-3957-7501,
要町病院,東京都豊島区要町1-11-13　,東京都豊島区,139.699158,35.733604,,03-3957-3181,
副都心病院,東京都豊島区要町1-18-5,東京都豊島区,139.697617,35.733917,,03-3957-2928,
安田耳鼻咽喉科,東京都豊島区要町1-21-6　,東京都豊島区,139.695999,35.733955,,03-3957-3387,
もみの木クリニック,東京都豊島区要町2-4-8　大恵ビル2階,東京都豊島区,139.693207,35.733261,,03-5966-5577,
守矢クリニック,東京都豊島区要町2-7-14　,東京都豊島区,139.693054,35.73476,,03-5995-5551,
千川産婦人科医院,東京都豊島区要町3-10-1　,東京都豊島区,139.690109,35.737534,,03-3957-1332,
わかしま内科・消化器科,東京都豊島区要町3-14-5　,東京都豊島区,139.687714,35.737675,,03-5964-8100,
もりかわ医院,東京都豊島区要町3-21-11-3F　,東京都豊島区,139.687897,35.738689,,03-5966-1316,
みなと小児科,東京都豊島区要町3-22-10-301　,東京都豊島区,139.688309,35.738869,,03-3973-5080,
せんかわ耳鼻咽喉科,東京都豊島区要町3-39-5　アジリア千川駅前2階,東京都豊島区,139.689453,35.738461,,03-5926-8077,
千川胃腸内科外科クリニック,東京都豊島区要町3-39-5　アジリア千川駅前2階,東京都豊島区,139.689453,35.738461,,03-5986-1020,
原内科クリニック,東京都豊島区高松2-48-7,東京都豊島区,139.70076,35.73914,,03-3955-2219,
清水医院,東京都豊島区高松2-56-7　,東京都豊島区,139.698181,35.739567,,03-3955-5308,
上野小児科医院,東京都荒川区南千住1-13-22 三ノ輪橋駅前ビル 203,東京都荒川区,139.791153,35.731907,,3806-4970,
荒木記念東京リバーサイド病院,東京都荒川区南千住8-4-4,東京都荒川区,139.806534,35.737522,,5850-0311,
荒川整形外科リハビリテーションクリニック,東京都荒川区荒川1-17-14,東京都荒川区,139.78717,35.735458,,3807-1600,
飯土用内科,東京都荒川区荒川3-23-13,東京都荒川区,139.781952,35.734253,,3891-5858,
岡田病院,東京都荒川区荒川5-3-1,東京都荒川区,139.775757,35.737495,,3891-2231,
木村病院,東京都荒川区町屋2-3-7,東京都荒川区,139.781357,35.744347,,3892-3161,
上智クリニック,東京都荒川区町屋4-9-10,東京都荒川区,139.776794,35.747101,,3892-4514,
たいら整形外科,東京都荒川区東尾久1-31-10 高六商事ビル 1F,東京都荒川区,139.769211,35.740101,,6807-7505,
熊野前医院,東京都荒川区東尾久3-19-8,東京都荒川区,139.77121,35.747169,,3819-2535,
小原医院,東京都荒川区東尾久6-8-5,東京都荒川区,139.774323,35.745758,,3895-8341,
いがらしクリニック,東京都荒川区西尾久1-32-16,東京都荒川区,139.762009,35.747234,,3800-9629,
宮の前診療所,東京都荒川区西尾久2-3-2,東京都荒川区,139.765457,35.749794,,3800-7111,
紅露医院,東京都荒川区西尾久2-26-7,東京都荒川区,139.763016,35.749496,,3894-6836,
?尾久クリニック,東京都荒川区西尾久6-15-5,東京都荒川区,139.758972,35.750908,,3800-1717,
?尾久リウマチ整形外科,東京都荒川区西尾久8-27-6,東京都荒川区,139.753937,35.753002,,6807-7740,
三ノ輪病院,東京都荒川区東日暮里1-4-3,東京都荒川区,139.790253,35.730576,,3803-2355,
日暮里上宮病院,東京都荒川区東日暮里2-29-8,東京都荒川区,139.785233,35.728626,,3891-5291,
東日暮里整形外科,東京都荒川区東日暮里3-44-12 feeth日暮里 1F,東京都荒川区,139.77887,35.730637,,3805-5558,
髙井医院,東京都荒川区東日暮里4-26-7,東京都荒川区,139.779861,35.726028,,3807-8131,
ひぐらし整形外科内科,東京都荒川区東日暮里5-34-1 OAKビル 4F,東京都荒川区,139.775146,35.728355,,5604-1236,
東京日暮里たんのハートクリニック,東京都荒川区東日暮里5-50-18 3F,東京都荒川区,139.772919,35.72797,,3806-1810,
みかわしまタワークリニック,東京都荒川区東日暮里6-1-1 アトラスブランズタワー三河島 2F,東京都荒川区,139.778275,35.732746,,3806-1133,
関川病院,東京都荒川区西日暮里1-4-1,東京都荒川区,139.777817,35.734486,,5604-5353,
日暮里健診プラザ,東京都荒川区西日暮里2-20-1 ステーションポートタワー 4F,東京都荒川区,139.770569,35.729099,,5850-1700,
日暮里内科・糖尿病内科クリニック,東京都荒川区西日暮里2-26-12-2F,東京都荒川区,139.771072,35.730057,,5838-6970,
小林医院,東京都荒川区西日暮里4-16-10,東京都荒川区,139.763779,35.732437,,3821-3846,
足高・森内科クリニック,東京都目黒区東山一丁目4番4号　目黒東山ビル2階,東京都目黒区,139.694885,35.646935,かかりつけ患者のみ,03-3710-2088,
ロコクリニック中目黒,東京都目黒区東山一丁目6番5号　シティハウス中目黒ステーションコート 1階,東京都目黒区,139.696289,35.646023,どなたでも可,電話での問い合わせ等不可。ホームページで受け付け。,
はっとりクリニック,東京都目黒区東山一丁目20番18号,東京都目黒区,139.692322,35.645523,かかりつけ患者のみ,ホームページからのみ受け付け。,
大橋眼科クリニック,東京都目黒区東山三丁目15番14号　メゾン・ド・カナリ1階,東京都目黒区,139.684723,35.649971,かかりつけ患者のみ,窓口で受け付け（接種は日曜日のみ実施）。,
中目黒アトラスクリニック,東京都目黒区上目黒一丁目26番1号 中目黒アトラスタワー4階,東京都目黒区,139.700409,35.643791,かかりつけ患者のみ,電話で受け付け。,
松井内科クリニック,東京都目黒区上目黒二丁目9番24号,東京都目黒区,139.699875,35.642471,かかりつけ患者のみ,窓口で受け付け（診察券を持参）。受付時間は7月中は火曜日・木曜日11時から12時まで、8月以降は診察日の11時から12時まで。,
中村外科医院,東京都目黒区上目黒二丁目10番2号,東京都目黒区,139.699097,35.641685,どなたでも可,ホームページ、窓口で受け付け。,
よう子みんなのクリニック,東京都目黒区上目黒二丁目42番11号　グレイス中目黒1階,東京都目黒区,139.694916,35.640762,かかりつけ患者のみ,診療時間内に電話：03-6412-8188で受け付け。,
ひでまる救急クリニック,東京都目黒区目黒一丁目4番11号　NTビル1・2階,東京都目黒区,139.713806,35.634399,かかりつけ患者のみ,電話、窓口で受け付け。,
村林クリニック,東京都目黒区目黒三丁目1番7号　日生目黒マンション202号,東京都目黒区,139.706146,35.63533,かかりつけ患者のみ,電話：03-3715-0138、窓口で受け付け。,
すけがわクリニック,東京都目黒区下目黒三丁目13番8号,東京都目黒区,139.709351,35.626873,かかりつけ患者のみ,Facebookを確認のうえ、診察時に予約。午前中は電話対応不可。,
五本木クリニック,東京都目黒区中央町二丁目18番14号　ネオアージュ祐天寺1階,東京都目黒区,139.68837,35.632866,かかりつけ患者のみ,受付時間内に電話で受け付け。詳細はホームページをご覧ください。,
川口整形外科眼科,東京都目黒区鷹番三丁目6番18号　カザーナ学芸大学2階,東京都目黒区,139.68457,35.628349,かかりつけ患者のみ,外来時に受け付け。,
鷹番クリニック,東京都目黒区鷹番三丁目14番21号,東京都目黒区,139.683685,35.629623,かかりつけ患者のみ,03-3793-9126,
学芸大学ファミリークリニック,東京都目黒区鷹番三丁目15番23号　アヴァンGAKUGEIビル2階,東京都目黒区,139.683899,35.629139,かかりつけ患者のみ,電話：03-5768-3930、窓口で受け付け。,
奈良橋医院,東京都目黒区中町二丁目20番7号,東京都目黒区,139.695084,35.633556,,電話での予約・問い合わせ不可。詳細はホームページまたは医院前掲示をご確認ください。,
上目黒診療所,東京都目黒区上目黒四丁目4番21号,東京都目黒区,139.692322,35.641403,どなたでも可,詳細はホームページをご覧ください。,
みずい整形外科,東京都目黒区祐天寺一丁目22番5号　1階,東京都目黒区,139.69191,35.638462,どなたでも可,090-9978-0789,
T's clinic,東京都目黒区五本木一丁目11番2号,東京都目黒区,139.69104,35.638115,かかりつけ患者のみ,03-3760-0055,
木村メディカルクリニック,東京都目黒区五本木三丁目25番15号,東京都目黒区,139.683624,35.631062,どなたでも可,,
高崎クリニック（高ははしごだか）,東京都目黒区目黒本町六丁目3番6号,東京都目黒区,139.697311,35.620647,かかりつけ患者のみ,電話で問い合わせのうえ窓口で受け付け。詳細はホームページをご覧ください。,
